{"api_version":"llm.temporal/v1","operation_key":"response-hit","operation_id":"op-hit","status":"completed","output":[],"checkpoint":{"handle":"ckp_v1.hit","kind":"cache_replay","depth":1},"cache":{"disposition":"hit","variant":2,"entry_age_seconds":12},"cost":{"status":"exact","actual_cost_usd":"0","method":"provider_reported"},"diagnostics":[{"code":"cache_origin_cost","severity":"info","path":"cache","message":"Original response cost; this cache replay incurs no new provider charge.","details":{"origin_operation_id":"op-origin","cost_status":"exact","actual_cost_usd":"0.0000123","method":"catalog_usage","catalog_version":"prices-origin"}}]}
