{"api_version":"llm.temporal/v1","operation_key":"root-1","operation_id":"op-1","status":"completed","output":[{"kind":"message","actor":"model","content":[{"kind":"text","text":"Approved."}]}],"checkpoint":{"handle":"ckp_v1.child","kind":"generation","depth":1},"cache":{"disposition":"miss_populated","variant":0,"entry_age_seconds":0},"cost":{"status":"exact","actual_cost_usd":"0.000014725","method":"provider_reported"},"diagnostics":[]}