{"api_version":"llm.temporal/v1","cache":{"disposition":"miss_populated","entry_age_seconds":0,"variant":7},"checkpoint":{"handle":"ckp_child","parent":"ckp_parent","kind":"generation","depth":2},"cost":{"actual_cost_usd":"0.000014725","catalog_version":"catalog-2026-08","method":"catalog_usage","status":"exact"},"diagnostics":[{"code":"route_selected","details":{"region":"us-east-1"},"message":"selected route","path":"route","severity":"info"}],"operation_id":"operation-1","operation_key":"forecast/turn/2","output":[{"actor":"model","content":[{"kind":"json","value":{"answer":"yes"}}],"kind":"message"}],"route":{"api_family":"responses","endpoint_id":"endpoint-1","requested_model":"model/test","resolved_model":"model/resolved","route_id":"route-1"},"status":"completed","usage":{"cache_read_tokens":3,"cache_write_tokens":1,"input_tokens":10,"output_tokens":2,"provider_raw":{"vendor":{"cached":true}},"reasoning_tokens":4}}